{
  "schema_version": "w4-server-context/0.2",
  "context_version": "synthetic-c01-context-v1",
  "data_kind": "SYNTHETIC",
  "project": {
    "project_id": "project-demo-sk-hynix",
    "owner_id": "user-demo"
  },
  "snapshot": {
    "snapshot_id": "synthetic-service-snapshot-v1",
    "episode_versions": {
      "v4-raw-cooperation": 1,
      "v4-raw-study": 1,
      "v4-raw-challenge": 1
    }
  },
  "episodes": [
    {
      "episode_id": "v4-raw-cooperation",
      "version": 1,
      "owner_id": "user-demo",
      "activity_id": "v4-raw-cooperation",
      "title": "가상 원문 v4-raw-cooperation",
      "raw_text": "저는 과학관 체험 부스의 접수 담당자였습니다.\n팀은 대기 시간을 10분 이내로 줄이는 목표를 정했습니다.\n저는 진행자와 의견을 나누고 접수와 체험 시작 시간을 함께 합의했습니다.\n동료 서현이 안내 표지의 문구를 바꿨습니다.\n평균 대기 시간이 18분에서 9분으로 줄었습니다."
    },
    {
      "episode_id": "v4-raw-study",
      "version": 1,
      "owner_id": "user-demo",
      "activity_id": "v4-raw-study",
      "title": "가상 원문 v4-raw-study",
      "raw_text": "저는 파일 검증 도구의 개발 담당자였습니다.\n저는 6주 동안 매주 JSON Schema 안내서를 읽고 검증 예제를 실습했습니다.\n저는 학습한 검증 규칙을 파일 업로드 기능에 적용했습니다.\n잘못된 형식의 파일이 저장되는 건수가 8건에서 0건으로 줄었습니다.\n저는 예제를 직접 바꾸며 검증하는 일이 중요하다는 점을 배웠습니다."
    },
    {
      "episode_id": "v4-raw-challenge",
      "version": 1,
      "owner_id": "user-demo",
      "activity_id": "v4-raw-challenge",
      "title": "가상 원문 v4-raw-challenge",
      "raw_text": "저는 개인 달리기 훈련의 참여자였습니다.\n저는 이전에 완주하지 못한 10km를 완주하겠다는 목표를 정했습니다.\n첫 시도에서 체력 부족으로 6km 지점에 멈췄습니다.\n저는 두 달 동안 매주 훈련 기록을 비교하고 속도를 조정하며 반복해서 연습했습니다.\n마지막 시도에서는 8km를 달렸습니다."
    }
  ],
  "excluded_episode_ids": [],
  "question_scope_id": "skhynix-2026-march-R260521-IT",
  "company_knowledge": {
    "schema_version": "w4-c01-knowledge/0.1-proposal",
    "profile": "w3-c01/0.2-candidate/r2",
    "upstream_commit": "05f26b4c0a52aecf155a66df0fcaa38e6fbd4cf5",
    "knowledge_bundle_id": "synthetic-c01-bundle-v1",
    "data_kind": "SYNTHETIC",
    "scope_id": "skhynix-2026-march-R260521-IT",
    "as_of": "2026-09-17",
    "sources": [
      {
        "signal": {
          "schema_version": "w3-c01/0.2-candidate",
          "source_id": "10000000-0000-4000-8000-000000000005",
          "event_cursor": 3,
          "required_event_cursor": 3,
          "restriction_revision": 2,
          "required_restriction_revision": 2,
          "generation": 4,
          "restriction_scope": "version",
          "reason": "READY",
          "index_ack": true,
          "index_key": {
            "source_version_id": "10000000-0000-4000-8000-000000000007",
            "extraction_revision_id": "10000000-0000-4000-8000-000000000008",
            "representation": "static_html",
            "normalization_version": "v1"
          },
          "history_complete": true,
          "event_type": "w3.source.usability.changed",
          "signal_id": "10000000-0000-4000-8000-000000000025",
          "usable": true
        },
        "knowledge_generation": 4,
        "knowledge": {
          "status": "COMPLETED",
          "errors": [],
          "bundle": {
            "mode": "SYNTHETIC",
            "purpose": "SYNTHETIC_ACCEPTANCE",
            "requirement_presence": "FOUND",
            "evidences": [
              {
                "evidence_id": "synthetic-evidence-0",
                "artifact_id": "synthetic-document",
                "source_ref": {
                  "source_id": "10000000-0000-4000-8000-000000000005",
                  "source_version_id": "10000000-0000-4000-8000-000000000007",
                  "source_kind": "synthetic_job_posting"
                },
                "excerpt": "가상 자료 1: 꾸준히 기술을 학습한 경험을 참고합니다.",
                "native_locator": {
                  "locator_type": "external_reference",
                  "value": "synthetic:c01:0:0",
                  "reproducible": true
                },
                "observed_integrity": {
                  "algorithm": "sha256",
                  "digest": "855bf19120c9c7502a19a6d8cda72b95394317921626e9acd1ce16e3b6d66e62",
                  "scope": "excerpt",
                  "reported_by": "W3_CURRENT"
                }
              },
              {
                "evidence_id": "synthetic-evidence-1",
                "artifact_id": "synthetic-document",
                "source_ref": {
                  "source_id": "10000000-0000-4000-8000-000000000005",
                  "source_version_id": "10000000-0000-4000-8000-000000000007",
                  "source_kind": "synthetic_job_posting"
                },
                "excerpt": "가상 자료 1: 배운 내용을 코드에 적용하고, 입력 검증 또는 문서 작성 경험이 있으면 우대합니다.",
                "native_locator": {
                  "locator_type": "external_reference",
                  "value": "synthetic:c01:0:1",
                  "reproducible": true
                },
                "observed_integrity": {
                  "algorithm": "sha256",
                  "digest": "f0114f6fca14a68db10b28193840c1de1f5e920ffb5b3f987ac108b7177a759f",
                  "scope": "excerpt",
                  "reported_by": "W3_CURRENT"
                }
              }
            ],
            "claims": [
              {
                "verification_status": "VERIFIED",
                "usage_status": "USABLE",
                "checks": [],
                "candidate_id": "synthetic-learning",
                "statement": "가상 자료 1: 꾸준히 기술을 학습한 경험을 참고합니다.",
                "evidence_ids": [
                  "synthetic-evidence-0"
                ]
              }
            ],
            "requirements": [
              {
                "verification_status": "VERIFIED",
                "usage_status": "USABLE",
                "checks": [],
                "candidate_id": "synthetic-application",
                "original_text": "가상 자료 1: 배운 내용을 코드에 적용하고, 입력 검증 또는 문서 작성 경험이 있으면 우대합니다.",
                "necessity": "PREFERRED",
                "evidence_ids": [
                  "synthetic-evidence-1"
                ],
                "root_node_id": "root",
                "condition_nodes": [
                  {
                    "node_id": "root",
                    "operator": "AND",
                    "text": "가상 자료 1: 배운 내용을 코드에 적용하고, 입력 검증 또는 문서 작성 경험이 있으면 우대합니다.",
                    "children": [
                      "apply",
                      "choice"
                    ],
                    "same_experience_required": true
                  },
                  {
                    "node_id": "apply",
                    "operator": "LEAF",
                    "text": "배운 내용을 코드에 적용",
                    "evidence_id": "synthetic-evidence-1"
                  },
                  {
                    "node_id": "choice",
                    "operator": "OR",
                    "text": "입력 검증 또는 문서 작성",
                    "children": [
                      "validation",
                      "documentation"
                    ]
                  },
                  {
                    "node_id": "validation",
                    "operator": "LEAF",
                    "text": "입력 검증 경험",
                    "evidence_id": "synthetic-evidence-1"
                  },
                  {
                    "node_id": "documentation",
                    "operator": "LEAF",
                    "text": "문서 작성 경험",
                    "evidence_id": "synthetic-evidence-1"
                  }
                ]
              }
            ],
            "source_reviews": [
              {
                "source_ref": {
                  "source_id": "10000000-0000-4000-8000-000000000005",
                  "source_version_id": "10000000-0000-4000-8000-000000000007",
                  "source_kind": "synthetic_job_posting"
                },
                "checks": [],
                "limitations": [],
                "process_status": "COMPLETED"
              }
            ],
            "limitations": []
          }
        },
        "metadata": {
          "source_id": "10000000-0000-4000-8000-000000000005",
          "index_key": {
            "source_version_id": "10000000-0000-4000-8000-000000000007",
            "extraction_revision_id": "10000000-0000-4000-8000-000000000008",
            "representation": "static_html",
            "normalization_version": "v1"
          },
          "scope_id": "skhynix-2026-march-R260521-IT",
          "content_sha256": "696c894c7595a59afbddce980507c68453699a808676686e24e7a0dad1900cb0",
          "published_at": "2026-09-01",
          "valid_from": "2026-09-01",
          "valid_to": "2026-12-31",
          "parse_status": "PARSED",
          "required_for_scope": true,
          "expires_at": "2026-09-17T00:30:00+00:00"
        }
      },
      {
        "signal": {
          "schema_version": "w3-c01/0.2-candidate",
          "source_id": "10000000-0000-4000-8000-000000000105",
          "event_cursor": 3,
          "required_event_cursor": 3,
          "restriction_revision": 2,
          "required_restriction_revision": 2,
          "generation": 4,
          "restriction_scope": "version",
          "reason": "READY",
          "index_ack": true,
          "index_key": {
            "source_version_id": "10000000-0000-4000-8000-000000000107",
            "extraction_revision_id": "10000000-0000-4000-8000-000000000108",
            "representation": "static_html",
            "normalization_version": "v1"
          },
          "history_complete": true,
          "event_type": "w3.source.usability.changed",
          "signal_id": "10000000-0000-4000-8000-000000000125",
          "usable": true
        },
        "knowledge_generation": 4,
        "knowledge": {
          "status": "COMPLETED",
          "errors": [],
          "bundle": {
            "mode": "SYNTHETIC",
            "purpose": "SYNTHETIC_ACCEPTANCE",
            "requirement_presence": "FOUND",
            "evidences": [
              {
                "evidence_id": "synthetic-evidence-0",
                "artifact_id": "synthetic-document",